,Song,Artist,Lyricist,Composer,Lyric
0,俺は俺で生きてるよ,"
瑛人",8s,8s,俺は俺で生きてるよ だから何も心配しないで いつか届くと信じながら 声枯らすまで歌うよ 最近夢描くインクが少し 減ってきてさ つまらなくなってきてる 絵に描いたような道ではないけど 自分で決めた道だから歩いてる 馬鹿にされたりもする 笑われて流す涙もある 全部受け止めて光を探してる 俺は俺で生きてるよ だから何も心配しないで いつか届くと信じながら 声枯らすまで歌うよ 俺は俺で生きてるよ だから何も邪魔をするな なんて言葉いわないからずっと隣にいてよ そこらへんの奴より頭悪いけど そこらへんの奴より足は速いよ 握り締めたその夢のボールを ずっと投げないままポケットにしまわないで 大事なもの失くすときもある もう走るのが嫌になる 全部受け止めて人は強くなる 俺は俺で生きてるよ だから何も心配しないで いつか届くと信じながら 声枯らすまで歌うよ 俺は俺で生きてるよ だから何も邪魔をするな なんて言葉いわないからずっと隣にいてよ
1,風旅,"
瑛人",瑛人・御徒町凧・長崎真吾,瑛人・御徒町凧・長崎真吾,錆びついた今日は いつもよりも眠たい 新品だった昨日には もう二度と会えない 周りが知りたいのは フツウの道標 あやつる言葉さえ めんどくさくなってきた そうだ どっか行こうたまには 君が疲れないほどに そんで 変な話もしよう 僕が飽きられないように 旅立ったあいつは ずっとずっと笑ってる 思い出はどうして 楽しいことばかり だから どっか遠いところへ 探しものはなんですか？ そんで フラっと帰る頃には 何か変わっているはずさ そういえば どっかってどこだろうな まぁいいか そうだ どっか行こうたまには 君が疲れないほどに そんで 変な話もしよう 僕が飽きられないように だから どっか遠いところへ 探しものはなんですか？ そんで フラっと帰る頃には 何か変わっているはずさ 風が吹き抜けますように
2,カルマ,"
瑛人",瑛人・RUNG HYANG,瑛人・RUNG HYANG・Shingo.S,もうその話はやめて ごめんまた明日にしようって 無理矢理電話を切り 吐き出したため息 今までどおりにしようって 2人まだ大丈夫だって なんとなくそう思ってた 曖昧な言葉使って その場しのぎで嘘ついて 君を忘れてた だから Baby Baby 甘えそうな僕を笑ってよ どうか Baby Baby だらけそうな僕を嫌ってよ そう伝えたいのに君はもういない 僕のカルマ 昨日バイト仲間から聞いて 覗いた君のインスタ あの細い薬指に光るシルバーのリング ふたり一緒に暮らそうって 月1万貯金しようって たまには旅行もいこうって 今さら思い出してんだ 何も見てなかったんだ 心を亡くして だから Baby Baby 甘えそうな僕を笑ってよ どうか Baby Baby だらけそうな僕を嫌ってよ そう伝えたいのに君はもういない 結局いくらあがいてみても 僕のカルマ
3,君の愛と僕の愛,"
瑛人",8s,8s,お願いそばに戻って来てなんて 言ってないのに 本当に君は僕の心がよくわかる人だね でもさ僕らわかってきた風が冷たくなると 君は泣いて その綺麗な心に傷をつけてしまうの 大丈夫と笑う君に 僕は言葉が何も出てこない ただ一つ言えるとしたら もうそんなことしなくていいよ 君の愛と僕の愛が少しだけ違ってただけ わからないよわかっていたよ 君とならって信じていた もっと僕ら許し合えてれば 君は幸せだったかな 春の風が訪れるように君は笑っていたね 君はもっと辛いんだろ でもかける言葉が出てこない ただ2つ言えるとしたら もうごめんねとありがとう 君の愛と僕の愛が少しだけ違ってただけ わからないよわかっていたよ 君とならって信じていた 2人が見てた夢の途中で 何かがずれて行ったね こう言うしかないでしょ 僕らのために 2人別の道を進むんだ
4,香水,"
瑛人",8s,8s,夜中にいきなりさ いつ空いてるのってLINE 君とはもう3年くらい会ってないのにどうしたの? あの頃 僕達はさ なんでもできる気がしてた 2人で海に行っては たくさん写真撮ったね でも見てよ今の僕を クズになった僕を 人を傷つけてまた泣かせても 何も感じ取れなくてさ 別に君を求めてないけど 横にいられると思い出す 君のドルチェ&ガッバーナの その香水のせいだよ 今更君に会ってさ 僕は何を言ったらいい? 「可愛くなったね」口先でしか言えないよ どうしたの いきなりさ タバコなんかくわえだして 悲しくないよ悲しくないよ 君が変わっただけだから でも見てよ今の僕を 空っぽの僕を 人に嘘ついて軽蔑されて 涙ひとつもでなくてさ 別に君を求めてないけど 横にいられると思い出す 君のドルチェ&ガッバーナのその香水のせいだよ 別に君をまた好きになることなんてありえないけど 君のドルチェ&ガッバーナの香水が思い出させる 何もなくても 楽しかった頃に 戻りたいとかは思わないけど 君の目を見ると思う 別に君を求めてないけど 横にいられると思い出す 君のドルチェ&ガッバーナの その香水のせいだよ 別に君をまた好きになるくらい君は素敵な人だよ でもまた同じことの繰り返しって 僕がフラれるんだ
5,シンガーソングライターの彼女,"
瑛人",8s,8s,君が作り置きしたカレーを今食べてる いつもこんな辛いの食べてるんだね 君が置いてったギターを今勝手に触ってる いつもこんな重たいの1人背負ってるんだね 投げ銭の中の小銭をかき分けては 千円を見つけたと君がニヤついた Love You Baby 今まで誰にもずっと言わずに心にとっといたのに Love You Baby 今なら言えるよ 愛を歌える君へ 君へ 今でも時々なんだか変な感じがするよ 君がぼくの目の前にいることすべてに でも日常になってる かすれた声でただいま 今日はたくさん歌って疲れてるんだね 2日目のカレーを一緒に食べようか なんて君が言うからぼくもニヤついた Love You Baby 今まで誰にもずっと言わずに心にとっといたのに Love You Baby 今なら言えるよ 愛を歌える君へ 君へ 寒い朝には手を握るよ 怖い夢みたら抱きしめるよ でも一個だけ一個だけ お願いさせて ぼくとの恋の終わりの歌は描かないで Love You Baby 今まで誰にもずっと言えずに心にとっといたのは 君のために 待ちわびていた ぼくの本当の気持ちなのかも Love You Baby 今まで誰にもずっと言わずに心にとっといたのに 君のギターをずっと持つからさ だから言わせて 君を愛してる
6,好きにすればいいさ,"
瑛人",瑛人,瑛人,手取り足取りやってみる 言葉の意味もわからない 調べて学ぶ そんな気にもならないんだ 嫌われてると思うなら 僕からしたら そりゃ おならが出るほど 退屈であくびも出ちゃう 怒りを歌にしてみよう あいつを殴る気持ちで でもやっぱりリタイア 飯をうまくたべたいから 好きにすればいいさ I don't give a shit 好きに生きたいから 僕はおかわりを頼むよ ハローハローから始まる 調子はどうなの 不可能を可能に変えるまで 僕は歌っているかも 気の利いた歌にしよう 自分を失くす気持ちで でもやっぱりやめた 兄貴達に馬鹿にされるから 好きにすればいいさ I don't give a shit スッキリイキたいから 弟なのは認めるよ Let your light shine あなただけの場所で Let your light shine 太陽もぴーかん Let your light shine あなただけの場所に Let your light shine 太陽もぴーかん 好きにすればいいさ I don't give a shit 好きに生きたいから 僕はおかわりを頼むよ 好きにすればいいさ I don't give a shit スッキリイキたいんだ いつか自分に会えるかな
7,掃除,"
瑛人",瑛人・御徒町凧,瑛人,いくらキレイにしたって 明日には汚れている 玄関様に言うんだ また今度磨くからね 全部お前が汚したと言われれば それまでだよ 良いことしても良いこと起こるとは限らない 人の心の埃は 誰がちり取るの 僕一人だけだと ハウスダストがでるよ 愛の片隅の闇は どう掃除するの まだ僕の風呂場には 赤カビがあるのにな 金がいくらなくても 今まで泣いたことはない なのに電車で赤ちゃんを見る度に泣きそうだ 僕を信じてもいいけど 天国には行けないよ 逆に君を信じても 何もいいことなさそう 人の間の汚れは 何で拭き取るの このままの僕たちだと タイムアウトになりそう 愛の片隅の闇は どう掃除するの まだ僕のシンクには 生ゴミがあるのにな 中途半端な優しさが 見えないところに染み付いて 僕と君を腐らせて こびり付いてもう剥がれない 人の心の埃は 誰がちり取るの 僕一人だけだと ハウスダストがでるよ 愛の片隅の闇は どう掃除するの まだ僕の風呂場には 赤カビがあるのにな 洋服も脱ぎっぱなし 窓も開けてないのに 換気扇も油まみれ 何もできてないのに 何もできてないのに
8,チェスト,"
瑛人",8s,8s,すっとかすれたようにしまる引き出し すっと進められない僕のこの道 たまには戻りたいよ今も思い出すよ 手を繋ぎ歩いた頃の写真のあの笑顔 あっとゆうまにすぎてく心の時間 ハッと気づいた時にはもう遅いかも ついてないことばかり後ろ振り向いちゃうよ うちの犬のトモも冴えない顔してる 頭の中が難しくて いつものように笑えない日もある そんなときは思い出して 支えてくれた人を 今の自分を終わらせないで いつか輝ける日がくるから だれかと比べ悲しまないで 君の引き出しは君が開けるもの きっとダメだろうってしまう時もある きっとこのまま進んでいくの どっちつかずの毎日くり返し生きる どっちでもいいんじゃない君が幸せなら ずっと同じところに置いたものは ずっと同じところにあるものさ 小さい頃の夢はなんだか覚えてる？ カブトムシって言ってた それが君らしいよ 出会いと別れが急すぎて ほんとうかわからない時もある そんな時はただひたすら 笑っていればいいよ 今の自分を終わらせないで いつか輝ける日がくるから だれかのせいなんて言わないで 君を開けるのは君しかいない 張り裂ける胸おさえてまで 偽りの自分じゃ意味がないから ただあなたのためだけに 僕は歌うよ 今の自分を諦めないで 生きてるだけで素晴らしいんだよ あなたのせいで幸せですと いつか言われるそんな日がくるまで
9,Don't be afraid feat.HOTDOGS,"
瑛人",瑛人・KAI・MINOR,瑛人・KAI・MINOR,笑い合えれば何もいらない 好きなことやって歌って踊りたい 寄せては返す波の音に体あずけて 瞬く間に過ぎゆく時 ゆれる心 胸に刻んでさ 今は何も考えずにただ 全てを手放して楽しもうぜ 地に足つけて on and on and on たまに出かける逃避行へと チクタク時が流れてく ほらあたふた足また掬われる けど顔上げて gotta go 進むだけ今日は今日 どうせ俺なんてもう とか言って落ち込んだってオーライ Don't be afraid Don't be afraid 君といれるこの時が Don't be afraid Don't be afraid 何よりも幸せ Don't be afraid Don't be afraid 君といれるこの時が Don't be afraid Don't be afraid 何よりも幸せさ 笑い合えるさ in the morning 心はポカポカ陽気 気持ちちょいと楽にして 食べて寝て繰り返したいね 鬼さんこちら 手の鳴る方へ 花見て穏やか 赤黄緑 過ぎたこと水に流して 今この時を楽しもう HOTDOGS と瑛人が乗り出し 初めましての人もお友達 になりたいから僕は歌い出し 集まる仲間ゆらす街 HOTDOGS と瑛人が乗り出し 初めましての人もお友達 になりたいから僕は歌い出し 集まる仲間ゆらす街 Don't be afraid Don't be afraid 君といれるこの時が Don't be afraid Don't be afraid 何よりも幸せ Don't be afraid Don't be afraid 君といれるこの時が Don't be afraid Don't be afraid 何よりも幸せさ 頭の中で難しく考えすぎてさ 本当の自分が誰かわからなくなってる？ 私なんか ってそんなこと言わないでよ Baby 君の好きなところは僕が知ってるから だから歌にのせて 君に愛をずっとずっと歌い続ける 僕が知らない君がいても どんな君でも大好きだから Don't be afraid Don't be afraid 君といれるこの時が Don't be afraid Don't be afraid 何よりも幸せ Don't be afraid Don't be afraid 君といれるこの時が Don't be afraid Don't be afraid 何よりも幸せさ Don't be afraid×8
10,ハッピーになれよ,"
瑛人",瑛人・RUNG HYANG,瑛人・RUNG HYANG,酒グセの悪い父ちゃん 酒に溺れて暴れがち 叩き起こされた母ちゃん キレて喧嘩になりがち 呆れる兄貴2人と 吹っ飛ばされる小さな俺と 壁にあいたこぶしの穴 でこぼこになった冷蔵庫 家を出るんだと母ちゃんが決めて 俺はワクワクした 真ん中の兄貴は父ちゃんの 飯もう食べられないと泣いた 一番上の兄貴はノーコメント 4人手をつないで遠くへ すっからかんの部屋を父ちゃんは どんな気持ちで見てたんだろう みんなハッピーになれよ どんな時でも ハッピーになれよ 結果オーライ 会いたくなってそれから 会いたくなくなってもいいから ハッピーになれよ もういいべ 黄色い上原モデルの グローブとヘルメを持って 野球を終えた帰り道 久しぶりに父ちゃんちへ 習ったばかりのスライディング 見せつけ自慢げホームイン すっからかんの部屋で父ちゃんは 泣いた顔して笑ってた みんなハッピーになれよ どんな時でも ハッピーになれよ 結果オーライ 会いたくなってそれから 会いたくなくなってもいいから ハッピーになれよ もういいべ 2年前はいつも一緒だったけど 2年経った今は一緒じゃないけど ハッピーになれよ どんな時でも ハッピーになれよ 結果オーライ 会いたくなってそれから 会いたくなくなってもいいから ハッピーになれよ もういいべ
11,ハピネス,"
瑛人",AI,AI・UTA,余裕がなくて 優しくなれない そんな時でも ちゃんと分かってくれている人がいる 周りを見渡せば いろんなドラマ でも嫌なニュースだけじゃない No no no 本当は溢れてる たくさんの笑顔が ほら こっち向いて 君が笑えば この世界中に もっと もっと 幸せが広がる 君が笑えば すべてが良くなる この手で その手で つながる Lala Lalala Lala Lalala 君と過ごしている時間を 特別だとか 思ってなかった でも 1人になったとき なんか分かった気がした 一緒にいれることの幸せ 本当に君に 会えて良かった どんなに嫌な1日だって 君の笑顔で 最高になっちゃう この星降る夜も 一緒に眺めていたい 君が笑えば この世界中に もっと もっと 幸せが広がる 君が笑えば すべてが良くなる この手で その手で つながる 街中が 光に包まれてく 君の所にも届いて欲しい 輝く 粉雪... This Winter また君を笑わせたい 君が笑えば この世界中に もっと もっと 幸せが広がる 君が笑えば すべてが良くなる この手で その手で つながる Lala Lalala Lala Lalala 君が笑えば この世界中に もっと もっと 幸せが広がる 君が笑えば すべてが良くなる この手で その手で つながる
12,HIPHOPは歌えない,"
瑛人",8s,8s,HIPHOPは歌えない 俺はリアルじゃないからさ 現実ばっかを見てたら きっと涙が出るんだ あーまた俺の嫌いな奴が目の前にいるよ だらしがないくせに酒を飲むともっとだるい 朝も起きれずに約束を破ってく 鏡の中二日酔いの男が笑うんだ HIPHOPは歌えない 俺はリアルじゃないからさ 現実ばっかをみてたらきっと涙が出るんだ とりあえずいいやとその場しのぎで嘘ついて 調子の良いことばかりを言っては空回り 何が好きで何が嫌いかも分かってない あやふやな言葉を借りて人をもてあました HIPHOPは歌えない 俺はリアルじゃないからさ 現実ばっかを見てたら きっと涙が出るんだ 愛想ばっかふってさ 俺は誰になりたいの 今日も誰かに言われてる お前はただのフェイクだと 会いたくはないけど 無理なんだここにいるよ 愛着もないけど しょうがないなこれが自分だから HIPHOPを歌いたい 俺もリアルになりたいよ 夢ばっかを語れば そりゃ楽しくなるもんさ 愛想ばっかふりかざして いつも笑ってるんじゃないよ だから言われるお前は ただのPEACE野郎だと
13,ピース オブ ケーク,"
瑛人",Eito・K,Eito・Junnosuke,端から見たら ただの仲間さ 気づく頃には もう忘れちゃうけど 好きとか嫌い それ以前の話 いつまで続くかも分からない あげようか？ このクッキーにはチョコがついてるから 嘘だよ マジな顔するから やっぱりあげない いきがってオールイン 悪くないな 100点よりも ピース オブ ケーク いつかなゴールイン 歩くように 全部あげるよ ピース オブ ケーク ゆったり行こう やめろって言っても 利き目はないだろう 三回ダメだったら シカトが一番 後ろ足をずっと蹴っぽってくるのは どうせ一人しかいないんだし 乗ってっていいよ ピカピカな僕のこの背中に 家まで送るよ 今、にやけたから やっぱり降りてくれ 群がって調子良い ワイのワイの 小さな世界で ピース オブ ケーク キッパリ Don' t need 興味ないや 大きな世界へ ピース オブ ケーク トンガっていよう レペゼン横浜からの瑛人 気にし出したらしょうもないそんなヘイト なんかで遊びたいっていう程度 低脳 英語 栄光 意味わからない みなとみらいで集合しようぜ 夢と期待気にしない仲間で 敵と破壊なんてくだらないぜ ピース オブ ケーク 単純でいいよ いきがってオールイン 悪くないな 100点よりも ピース オブ ケーク いつかなゴールイン 歩くように 全部あげるよ ピース オブ ケーク ゆったり行こう
14,僕はバカ,"
瑛人",8s,8s,隣の部屋から聞こえる 壁を通してあの子の歌が だからテレビも全部消して コーヒーをゆっくりいれるよ あれなんだか今日は聞こえない？ 結構楽しみにしてたのに 別にあの子の事は気になるくらいで どうでもいいけど 映画の見過ぎでロマンティックなことを考えちゃう 間違えて僕の家のドア開けないかな わかるでしょ 僕はバカ でも君に今恋してる 青い空の下で君と弁当食べたいな 火曜日の燃えるゴミの日に 前の彼女との写真を捨てた すると君もゴミを捨てにきていて うつむきご挨拶 映画の見すぎでロマンティックなことに憧れちゃう 頭の中ではもう手は繋いでるのに わかるでしょ 僕はバカ でも君に今恋してる 青い空の下で君とアイスを食べたいな 気付いてんだよ 君の部屋に入る大きな足音 気付いているんだよ 君はそいつのことが好き わかってる 僕はバカ でも君に今恋してる 青い空の下でもっと君のこと知りたいんだ わかるでしょ 僕はバカ でも君に今恋してる 青い空の下で君と弁当食べたいな
15,またね (feat.松本千夏),"
瑛人",えいととちなつ,えいととちなつ,寒くなると君は一回寝たら手強い なぁ起きてよ、君の好きな雪が降ってるよ 君もそうだよ しかもうるさいいびきが聞こえる すぐ布団蹴るからいつも直してあげたの この景色を見せてあげたいんだ 君が知らない世界なんだ 届かない想い止まったままの時間 ここでまた君と 大好きだよ今も大好きだよ どうせまた会えるでしょ 僕と君なら 大好きだよ今も大好きだよ どうせまた歌うでしょ 2人だけの歌 なぁ覚えてる? クリスマスの日に君が ケーキ落として泣いちゃってたこと 寂しすぎるよ 大丈夫だよ 会いたいんだよ今すぐに でも笑って見せてよ ずっとずっと 大好きだよ今も大好きだよ どうせまた会えるでしょ 僕と君なら 大好きだよ今も大好きだよ どうせまた歌うでしょ 2人だけの歌 泣かないでってどうせ君は言うだろでもそんな僕は強くない 雪が降ってるよ 君も今笑ってみてるの 戻ってきてよまた声を聞かせてよ 大好きだよ今も大好きだよ どうせまた会えるでしょ 僕と君なら 大好きだよ今も大好きだよ どうせまた歌うでしょ 2人だけの歌
16,またね feat.松本千夏 (Album ver.),"
瑛人",えいととちなつ,えいととちなつ,寒くなると君は一回寝たら手強い なぁ起きてよ、君の好きな雪が降ってるよ 君もそうだよ しかもうるさいいびきが聞こえる すぐ布団蹴るからいつも直してあげたの この景色を見せてあげたいんだ 君が知らない世界なんだ 届かない想い止まったままの時間 ここでまた君と 大好きだよ今も大好きだよ どうせまた会えるでしょ 僕と君なら 大好きだよ今も大好きだよ どうせまた歌うでしょ 2人だけの歌 なぁ覚えてる？ クリスマスの日に君が ケーキ落として泣いちゃってたこと 寂しすぎるよ 大丈夫だよ 会いたいんだよ今すぐに でも笑って見せてよ ずっとずっと 大好きだよ今も大好きだよ どうせまた会えるでしょ 僕と君なら 大好きだよ今も大好きだよ どうせまた歌うでしょ 2人だけの歌 泣かないでってどうせ君は言うだろ でもそんな僕は強くない 雪が降ってるよ 君も今笑ってみてるの 戻ってきてよまた声を聞かせてよ 大好きだよ今も大好きだよ どうせまた会えるでしょ 僕と君なら 大好きだよ今も大好きだよ どうせまた歌うでしょ 2人だけの歌 どうせまた会えるでしょ 僕と君なら
17,ライナウ,"
瑛人",瑛人・RUNG HYANG,瑛人・RUNG HYANG,コンビニに寄り道なんか買っていこうぜ って財布に金入ってないや しょうがねえおごってやるわ T字路 左にまっすぐ進んで あの鉄塔の下まで 走れ一番はだれ？ 風が吹く街を ぼんやり見下ろしてる 計画はしないって計画で ノリで告ったり フラれて泣いたり 毎日ダサいことばかり ごめんね チャリで転んだり なのに笑えたり 明日に持ち越せないドキドキ ほしいな ライナウ いつも外してばっかりいるよな 悔しそうなその顔 申し訳ないけど最高！ 笑い話にいつか変わるから あの鉄塔の下まで 向かいながら忘れちゃえ 教科書の中の宇宙を眺めてたら なんかでかいことができそうさ ノリで踊ったり 歌を歌ったり 毎日ゆるいことばかり ごめんね シャレで小突いたり マジで怒ったり 明日に持ち越せないドキドキ してんだ ライナウ
